<?xml version="1.0" encoding="UTF-8" ?>
<model xmlns:xsi="http://www.w3.org/2001/XMLSchema-instance"
       xsi:noNamespaceSchemaLocation="https://champi.sytes.net/SiorVen/res/xsd/machine.xsd">
    <manufacturer>Sony</manufacturer>
    <modelReference>XD</modelReference>
    <products>
        <product>SNACKS</product>
        <product>CANS</product>
    </products>
    <distributions>
        <matrix name="PanelGeneral" rows="8" cols="5" capacity="10">
            <resourceTypes>
                <resourceType>ITEM</resourceType>
            </resourceTypes>
        </matrix>
    </distributions>
</model>